Pt.Cahaya Mekar Jaya,4.8,81,"Ruko citi 9, Blk. D No.11, Randuboyo, Ngipik, Kabupaten Gresik",,https://www.google.com/maps/place/?q=place_id:ChIJ8VAeH9H_dy4RyLh_Z7W_LcM
PT. SMELTING,4.5,444,"Maduran, Jl. Raya Roomo No.224, Kabupaten Gresik",http://www.ptsmelting.com/,https://www.google.com/maps/place/?q=place_id:ChIJYTqFm48A2C0REm3n2jCTzRE
PT. Gerbang Cahaya Utama,4,1,"JL. Tanjung Batu No. 25-27, West Perak, Surabaya",,https://www.google.com/maps/place/?q=place_id:ChIJsaM2Q9r41y0RJnyem_l70_s
PT. Alas Petala Makmur,4.1,29,"Jl. Tambak Langon No.18, Tambak Langon, Surabaya",,https://www.google.com/maps/place/?q=place_id:ChIJc90WRfT-1y0RXab986p-2pI
Gramitrama Jaya Steel. PT,4.3,100,"Jl. Mayjend Sungkono No.28, Sekarkurung, Kabupaten Gresik",,https://www.google.com/maps/place/?q=place_id:ChIJB_gPgAwA2C0RKBc3qqtTdAM
PT. PERWITA NUSARAYA MJI GRESIK,4.2,31,"Jl. Surakarta III No.02, Randuagung, Kabupaten Gresik",https://www.facebook.com/perwitanusarayagresik/,https://www.google.com/maps/place/?q=place_id:ChIJnRYw6yr-dy4RVuNPIBikZz0
PT. MITRA DRAJAT SENTOSA,4.8,38,"BLOK E/31 PERUM GREEN HILL, Sekarkurung, Kabupaten Gresik",http://mitradrajatsentosa.co.id/,https://www.google.com/maps/place/?q=place_id:ChIJpxLRS6b_dy4Rizty0-aZ54k
PT.SPS Cabang Gresik,4.5,4,"Jl. Airlangga No.77, Sekarkurung, Kabupaten Gresik",,https://www.google.com/maps/place/?q=place_id:ChIJMSuzEeP_dy4RHUT5PagAyts
Perikanan Nusantara. PT Persero - Surabaya,4.1,34,"Jl. Nilam Barat No.16, Perak Utara, Surabaya",,https://www.google.com/maps/place/?q=place_id:ChIJrXqDi7P41y0R-DeetX1Pd-M
PT. RANTEINDO TEKNIK MANDIRI,4.6,10,"VJ3H+925, Sekarsore, Roomo, Kabupaten Gresik",https://ranteindo.com/,https://www.google.com/maps/place/?q=place_id:ChIJf6ZIteQB2C0RtiZ1NC-GqME
PT.Samudra Raya Jaya,4,4,"Greges jaya 1 no 6, Greges, Surabaya",,https://www.google.com/maps/place/?q=place_id:ChIJjTwAzQL_1y0RtjOhptdrkgU
"PT. Salim Ivomas Pratama, Tbk",4.4,320,"Jl. Tj. Tembaga No.2-6, Perak Bar., Surabaya",http://www.simp.co.id/,https://www.google.com/maps/place/?q=place_id:ChIJyyGEuM_41y0RYj5ZNfZcsuc
PT. Manunggal Karya Jati,4.1,77,"Blok A1 No. 8 Ruko Manyar Resort, Jl. Raya Sukomulyo, Wonorejo, Yosowilangun, Kabupaten Gresik",,https://www.google.com/maps/place/?q=place_id:ChIJrztXCyH-dy4RRKhho9Hv4Po
ACID PLANT WWTP (PT. SMELTING CORP),4.3,91,"VJ6P+5FM, Roomo Vilage Manyan Distrct, Roomo, Manyar, Maduran, Roomo, Kabupaten Gresik",http://www.ptsmelting.com/,https://www.google.com/maps/place/?q=place_id:ChIJ89NSwpEA2C0Rz4dSRmagZq0
PT Cakraindo Mitra Internasional,4.6,5,"Jalan Osowilangun no 8D - 9, RW.9, Tambak Osowilangun, Surabaya",https://cakraindo.com/,https://www.google.com/maps/place/?q=place_id:ChIJuX2qDQL_1y0RsgCNmfOgbqc
PT. Samator Gas Industri Veterantama,4.3,45,"RM84+FP5, Leker, Kramatinggil, Gresik Regency",http://samator.com/,https://www.google.com/maps/place/?q=place_id:ChIJUeFMci8A2C0RJdiiTUU8VNM
PT Petrokopindo Cipta Selaras,4.5,82,"Jl. Raya Roomo No.242, Maduran, Roomo, Kabupaten Gresik",http://www.petrokopindo.com/,https://www.google.com/maps/place/?q=place_id:ChIJrdqSI18B2C0RxQQcG7YVMfU
PT. Masa Manunggal Mandiri,4.4,21,"Jl. Kepatihan Industri No.10, Guntung, Kepatihan, Kabupaten Gresik",,https://www.google.com/maps/place/?q=place_id:ChIJm1CPKYwAeC4RtNQ8gwWD_aA
PT. SAMUDRA TEKNIK INDONESIA,4.5,2,"Jl. Jati Regency I, Kembangan, Gresik Regency",,https://www.google.com/maps/place/?q=place_id:ChIJv4SlcX7_dy4RrP03CauLa_M
PT. Gresik Migas,4.4,34,"Jl. DR. Wahidin Sudiro Husodo No.708, Kembangan, Kabupaten Gresik",http://gresikmigas.co.id/,https://www.google.com/maps/place/?q=place_id:ChIJU1mtXUEA2C0Rl51b7dXYA_I
PT INDOTANK,4.2,24,"Jl. Kalianak Barat No.57A, Asem Rowo, Surabaya",http://www.indotank.com/,https://www.google.com/maps/place/?q=place_id:ChIJxdVFENn-1y0R1uvBn4jQUrw
PT Rukun Aman Sejahtera,4.7,21,"B,, Jl. Kalianak Timur No.73, Kalianak, Surabaya",https://www.rukunamansejahtera.co.id/,https://www.google.com/maps/place/?q=place_id:ChIJ3Wcxb-D-1y0Rz1NX6Gayqlo
PT. Varia Usaha Fabrikasi,4.3,29,"Jl. DR. Wahidin Sudiro Husodo No.100, Setingi, Randuagung, Kabupaten Gresik",http://vufabrikasi.id/,https://www.google.com/maps/place/?q=place_id:ChIJva21_qEB2C0RXqBrfHZBvwg
PT. AKR Corporindo,4.2,35,"Pergudangan Surimulia Permai blok A6, 7, 8, Margomulyo No.44, Greges, Surabaya",http://www.akr.co.id/,https://www.google.com/maps/place/?q=place_id:ChIJ9wQmVub-1y0RDkpvMtVd2qs
PT Bina Karya Prima,3.9,89,"Jl. Kig Raya Barat No.Kav. L, Randuagung, Kabupaten Gresik",,https://www.google.com/maps/place/?q=place_id:ChIJAYXIE4EA2C0RzasWzEfC3XM
PT. Arthatama Pelita Nusa,5,8,"Jl. Kalianak Barat No.51-D, RT.002/RW.01, Kalianak, Surabaya",,https://www.google.com/maps/place/?q=place_id:ChIJuSDBzlf_1y0RG64OFNG-eTs
PT. Pusaka Bawean Group,4.3,3,"Jl. Green Garden Regency Blk. D1 No.1, Dahanrejo, Kabupaten Gresik",,https://www.google.com/maps/place/?q=place_id:ChIJcQff7RMA2C0RRY609IOga9g
PT Jaya Baru Malanti,4.5,23,"Jl. Kalianak Barat No.68, Kalianak, Surabaya",,https://www.google.com/maps/place/?q=place_id:ChIJrwjwOCf_1y0Rpp_66TbSeWk
PT. REXLINE ENGINEERING INDONESIA (HEAD OFFICE),4.3,35,"Margomulyo Angtropolis No.46 Blok H-9, Greges, Surabaya",https://rexlineengineering.com/,https://www.google.com/maps/place/?q=place_id:ChIJpVvlqf3laS4RQFpqKtBYnhg
"Nilam Port Terminal Indonesia, PT (Container Yard Office)",4.4,68,"Jl. Nilam Barat No.Timur, Perak Utara, Surabaya",,https://www.google.com/maps/place/?q=place_id:ChIJz8puZLb41y0RQJk_tne3IX8
PT. Agri Timur Mas,4.2,28,"VJH6+M5C, Tenger, Roomo, Kabupaten Gresik",,https://www.google.com/maps/place/?q=place_id:ChIJZ1BMBAX-dy4Re5q3QTChoiE
PT. Karya Brother Nusamesindo Surabaya,5,8,"QMF4+R67, Tambak Osowilangun, Surabaya",,https://www.google.com/maps/place/?q=place_id:ChIJL9vVOzv_1y0RN2SdiOol_0Q
AMG,4.7,9,"Jl. DR. Wahidin Sudiro Husodo No.76, Setingi, Randuagung, Kabupaten Gresik",,https://www.google.com/maps/place/?q=place_id:ChIJ9Q5LT3gA2C0RVLlbOytcij4
PT. Bahtera Adi Jaya,4.5,11,"Jl. Margomulyo No.70, Tambak Sarioso, Surabaya",http://www.bahteraadijaya.com/,https://www.google.com/maps/place/?q=place_id:ChIJgy4pfPb-1y0R3xwrn6rsb_k
PT SAPTA AJI MANUNGGAL PRIMA,4.3,6,"Jl. Tambak Osowilangun No.35 Blok B-12, Tambak Osowilangun, Surabaya",,https://www.google.com/maps/place/?q=place_id:ChIJ0akIIyL_1y0RA0OH4B8HNKM
PT. Asal Jaya,5,4,"Jl. Ikan Teri, Perak Bar., Surabaya",,https://www.google.com/maps/place/?q=place_id:ChIJKx8xjyj51y0RJy1OSklt-Fc